"Status","Start Time","Stop Time","Duration in ms","Parent Suite","Suite","Sub Suite","Test Class","Test Method","Name","Description"
"passed","Fri Oct 31 01:33:09 GMT 2025","Fri Oct 31 01:33:09 GMT 2025","8","","com.distributedMessenger.unit.services.MessageServiceUnitTest","","com.distributedMessenger.unit.services.MessageServiceUnitTest","getMessage should return null when it does not exist","getMessage should return null when it does not exist",""
"passed","Fri Oct 31 01:33:01 GMT 2025","Fri Oct 31 01:33:10 GMT 2025","8901","","com.distributedMessenger.integration.services.UserServiceIntegrationTest","","com.distributedMessenger.integration.services.UserServiceIntegrationTest","findByUserName should return user for existing username","findByUserName should return user for existing username",""
"passed","Fri Oct 31 01:33:08 GMT 2025","Fri Oct 31 01:33:08 GMT 2025","227","","com.distributedMessenger.unit.services.ChatServiceUnitTest","","com.distributedMessenger.unit.services.ChatServiceUnitTest","createChat should call repository and return new chat id","createChat should call repository and return new chat id",""
"passed","Fri Oct 31 01:32:43 GMT 2025","Fri Oct 31 01:32:52 GMT 2025","8421","","com.distributedMessenger.unit.repositories.ChatRepositoryUnitTest","","com.distributedMessenger.unit.repositories.ChatRepositoryUnitTest","getChatsByUser should return all chats for a specific user","getChatsByUser should return all chats for a specific user",""
"passed","Fri Oct 31 01:52:39 GMT 2025","Fri Oct 31 01:52:39 GMT 2025","93","","com.distributedMessenger.generatorreport.GeneratorReport","","com.distributedMessenger.generatorreport.GeneratorReport","tracingReport","tracingReport",""
"passed","Fri Oct 31 01:32:53 GMT 2025","Fri Oct 31 01:32:53 GMT 2025","35","","com.distributedMessenger.unit.repositories.UserRepositoryUnitTest","","com.distributedMessenger.unit.repositories.UserRepositoryUnitTest","getUser with non-existent id should return null","getUser with non-existent id should return null",""
"passed","Fri Oct 31 01:33:12 GMT 2025","Fri Oct 31 01:33:12 GMT 2025","32","","com.distributedMessenger.integration.services.UserServiceIntegrationTest","","com.distributedMessenger.integration.services.UserServiceIntegrationTest","deleteUser should remove user from the database","deleteUser should remove user from the database",""
"passed","Fri Oct 31 01:33:08 GMT 2025","Fri Oct 31 01:33:08 GMT 2025","29","","com.distributedMessenger.unit.services.BlockServiceUnitTest","","com.distributedMessenger.unit.services.BlockServiceUnitTest","unblockUser should return true when successful","unblockUser should return true when successful",""
"passed","Fri Oct 31 01:33:13 GMT 2025","Fri Oct 31 01:33:13 GMT 2025","8","","com.distributedMessenger.unit.services.UserServiceUnitTest","","com.distributedMessenger.unit.services.UserServiceUnitTest","getUser should return user when user exists","getUser should return user when user exists",""
"passed","Fri Oct 31 01:32:52 GMT 2025","Fri Oct 31 01:32:52 GMT 2025","152","","com.distributedMessenger.unit.repositories.MessageRepositoryUnitTest","","com.distributedMessenger.unit.repositories.MessageRepositoryUnitTest","addMessage should save a message and allow retrieval","addMessage should save a message and allow retrieval",""
"passed","Fri Oct 31 01:32:53 GMT 2025","Fri Oct 31 01:32:53 GMT 2025","43","","com.distributedMessenger.integration.repositories.UserRepositoryIntegrationTest","","com.distributedMessenger.integration.repositories.UserRepositoryIntegrationTest","deleteUser for non-existent user should return false","deleteUser for non-existent user should return false",""
"passed","Fri Oct 31 01:32:52 GMT 2025","Fri Oct 31 01:32:52 GMT 2025","126","","com.distributedMessenger.unit.repositories.ChatRepositoryUnitTest","","com.distributedMessenger.unit.repositories.ChatRepositoryUnitTest","addChat should correctly save a chat","addChat should correctly save a chat",""
"passed","Fri Oct 31 01:33:09 GMT 2025","Fri Oct 31 01:33:09 GMT 2025","9","","com.distributedMessenger.unit.services.BlockServiceUnitTest","","com.distributedMessenger.unit.services.BlockServiceUnitTest","unblockUser should return false when repository fails","unblockUser should return false when repository fails",""
"passed","Fri Oct 31 01:33:14 GMT 2025","Fri Oct 31 01:33:14 GMT 2025","9","","com.distributedMessenger.unit.services.FileServiceUnitTest","","com.distributedMessenger.unit.services.FileServiceUnitTest","getUserFiles should return an empty list when user has no files","getUserFiles should return an empty list when user has no files",""
"passed","Fri Oct 31 01:32:52 GMT 2025","Fri Oct 31 01:32:53 GMT 2025","109","","com.distributedMessenger.unit.repositories.MessageHistoryRepositoryUnitTest","","com.distributedMessenger.unit.repositories.MessageHistoryRepositoryUnitTest","getHistoryForMessage for a message with no history should return an empty list","getHistoryForMessage for a message with no history should return an empty list",""
"passed","Fri Oct 31 01:32:52 GMT 2025","Fri Oct 31 01:32:52 GMT 2025","121","","com.distributedMessenger.unit.repositories.AppSettingsRepositoryUnitTest","","com.distributedMessenger.unit.repositories.AppSettingsRepositoryUnitTest","initializeDefaultSettings should populate db only if it is empty","initializeDefaultSettings should populate db only if it is empty",""
"passed","Fri Oct 31 01:33:12 GMT 2025","Fri Oct 31 01:33:12 GMT 2025","32","","com.distributedMessenger.integration.services.UserServiceIntegrationTest","","com.distributedMessenger.integration.services.UserServiceIntegrationTest","updateUserRole should change role in the database","updateUserRole should change role in the database",""
"passed","Fri Oct 31 01:35:25 GMT 2025","Fri Oct 31 01:35:29 GMT 2025","4436","","com.distributedMessenger.e2e.UserLifecycleE2ETest","","com.distributedMessenger.e2e.UserLifecycleE2ETest","userFullLifecycleScenarioCRUD","userFullLifecycleScenarioCRUD",""
"passed","Fri Oct 31 01:33:14 GMT 2025","Fri Oct 31 01:33:14 GMT 2025","81","","com.distributedMessenger.unit.services.FileServiceUnitTest","","com.distributedMessenger.unit.services.FileServiceUnitTest","getFile should return null when file does not exist","getFile should return null when file does not exist",""
"passed","Fri Oct 31 01:33:14 GMT 2025","Fri Oct 31 01:33:14 GMT 2025","259","","com.distributedMessenger.unit.services.FileServiceUnitTest","","com.distributedMessenger.unit.services.FileServiceUnitTest","getUserFiles should return a list of files for a user","getUserFiles should return a list of files for a user",""
"passed","Fri Oct 31 01:32:52 GMT 2025","Fri Oct 31 01:32:52 GMT 2025","93","","com.distributedMessenger.integration.repositories.UserRepositoryIntegrationTest","","com.distributedMessenger.integration.repositories.UserRepositoryIntegrationTest","findByUsername should return correct user when exists","findByUsername should return correct user when exists",""
"passed","Fri Oct 31 01:33:13 GMT 2025","Fri Oct 31 01:33:13 GMT 2025","11","","com.distributedMessenger.unit.services.UserServiceUnitTest","","com.distributedMessenger.unit.services.UserServiceUnitTest","updateUser should return true when user exists and is updated","updateUser should return true when user exists and is updated",""
"passed","Fri Oct 31 01:33:07 GMT 2025","Fri Oct 31 01:33:07 GMT 2025","46","","com.distributedMessenger.unit.services.AppSettingsServiceUnitTest","","com.distributedMessenger.unit.services.AppSettingsServiceUnitTest","getSetting should return value when setting exists","getSetting should return value when setting exists",""
"passed","Fri Oct 31 01:32:53 GMT 2025","Fri Oct 31 01:32:53 GMT 2025","49","","com.distributedMessenger.unit.repositories.UserRepositoryUnitTest","","com.distributedMessenger.unit.repositories.UserRepositoryUnitTest","updateUser for non-existent user should return false","updateUser for non-existent user should return false",""
"passed","Fri Oct 31 01:33:08 GMT 2025","Fri Oct 31 01:33:08 GMT 2025","42","","com.distributedMessenger.unit.services.ChatServiceUnitTest","","com.distributedMessenger.unit.services.ChatServiceUnitTest","joinChatNetwork should delegate call to p2pTransport","joinChatNetwork should delegate call to p2pTransport",""
"passed","Fri Oct 31 01:33:07 GMT 2025","Fri Oct 31 01:33:07 GMT 2025","16","","com.distributedMessenger.unit.services.AppSettingsServiceUnitTest","","com.distributedMessenger.unit.services.AppSettingsServiceUnitTest","updateSetting should return true on successful update","updateSetting should return true on successful update",""
"passed","Fri Oct 31 01:33:07 GMT 2025","Fri Oct 31 01:33:07 GMT 2025","21","","com.distributedMessenger.unit.services.AppSettingsServiceUnitTest","","com.distributedMessenger.unit.services.AppSettingsServiceUnitTest","updateSetting should propagate exception from repository","updateSetting should propagate exception from repository",""
"passed","Fri Oct 31 01:33:12 GMT 2025","Fri Oct 31 01:33:12 GMT 2025","40","","com.distributedMessenger.unit.services.UserServiceUnitTest","","com.distributedMessenger.unit.services.UserServiceUnitTest","updateUser should return false when user not found","updateUser should return false when user not found",""
"passed","Fri Oct 31 01:32:52 GMT 2025","Fri Oct 31 01:32:53 GMT 2025","159","","com.distributedMessenger.unit.repositories.MessageRepositoryUnitTest","","com.distributedMessenger.unit.repositories.MessageRepositoryUnitTest","getMessagesAfter should return only messages after the given timestamp","getMessagesAfter should return only messages after the given timestamp",""
"passed","Fri Oct 31 01:33:14 GMT 2025","Fri Oct 31 01:33:14 GMT 2025","19","","com.distributedMessenger.unit.services.FileServiceUnitTest","","com.distributedMessenger.unit.services.FileServiceUnitTest","uploadFile should call repository and return new file id on success","uploadFile should call repository and return new file id on success",""
"passed","Fri Oct 31 01:33:07 GMT 2025","Fri Oct 31 01:33:08 GMT 2025","1366","","com.distributedMessenger.unit.services.MessageServiceUnitTest","","com.distributedMessenger.unit.services.MessageServiceUnitTest","getMessageHistory should return empty list when no history exists","getMessageHistory should return empty list when no history exists",""
"passed","Fri Oct 31 01:32:53 GMT 2025","Fri Oct 31 01:32:53 GMT 2025","45","","com.distributedMessenger.integration.repositories.UserRepositoryIntegrationTest","","com.distributedMessenger.integration.repositories.UserRepositoryIntegrationTest","updateUser should correctly change user data","updateUser should correctly change user data",""
"passed","Fri Oct 31 01:33:09 GMT 2025","Fri Oct 31 01:33:09 GMT 2025","135","","com.distributedMessenger.unit.services.MessageServiceUnitTest","","com.distributedMessenger.unit.services.MessageServiceUnitTest","sendMessage should propagate exception when repository fails","sendMessage should propagate exception when repository fails",""
"passed","Fri Oct 31 01:32:52 GMT 2025","Fri Oct 31 01:32:53 GMT 2025","58","","com.distributedMessenger.unit.repositories.UserRepositoryUnitTest","","com.distributedMessenger.unit.repositories.UserRepositoryUnitTest","getAllUsers should return an empty list when no users exist","getAllUsers should return an empty list when no users exist",""
"passed","Fri Oct 31 01:33:13 GMT 2025","Fri Oct 31 01:33:14 GMT 2025","586","","com.distributedMessenger.unit.services.UserServiceUnitTest","","com.distributedMessenger.unit.services.UserServiceUnitTest","register should call repository and return new user id","register should call repository and return new user id",""
"passed","Fri Oct 31 01:33:10 GMT 2025","Fri Oct 31 01:33:11 GMT 2025","1113","","com.distributedMessenger.integration.services.UserServiceIntegrationTest","","com.distributedMessenger.integration.services.UserServiceIntegrationTest","login should return Success for existing username","login should return Success for existing username",""
"passed","Fri Oct 31 01:33:09 GMT 2025","Fri Oct 31 01:33:09 GMT 2025","40","","com.distributedMessenger.unit.services.MessageServiceUnitTest","","com.distributedMessenger.unit.services.MessageServiceUnitTest","getMessageHistory should return list of history records","getMessageHistory should return list of history records",""
"passed","Fri Oct 31 01:35:54 GMT 2025","Fri Oct 31 01:36:01 GMT 2025","6782","","com.distributedMessenger.e2e.bdd.AuthenticationBehaviorSpec","","com.distributedMessenger.e2e.bdd.AuthenticationBehaviorSpec","Then: последняя попытка должна вернуть результат блокировки","Then: последняя попытка должна вернуть результат блокировки",""
"passed","Fri Oct 31 01:32:52 GMT 2025","Fri Oct 31 01:32:52 GMT 2025","166","","com.distributedMessenger.unit.repositories.AppSettingsRepositoryUnitTest","","com.distributedMessenger.unit.repositories.AppSettingsRepositoryUnitTest","updateSetting with valid value should succeed","updateSetting with valid value should succeed",""
"passed","Fri Oct 31 01:33:08 GMT 2025","Fri Oct 31 01:33:08 GMT 2025","242","","com.distributedMessenger.unit.services.ChatServiceUnitTest","","com.distributedMessenger.unit.services.ChatServiceUnitTest","getChat should return null when chat does not exist","getChat should return null when chat does not exist",""
"passed","Fri Oct 31 01:33:09 GMT 2025","Fri Oct 31 01:33:09 GMT 2025","9","","com.distributedMessenger.unit.services.MessageServiceUnitTest","","com.distributedMessenger.unit.services.MessageServiceUnitTest","getChatMessages should return empty list when no messages in chat","getChatMessages should return empty list when no messages in chat",""
"passed","Fri Oct 31 01:33:12 GMT 2025","Fri Oct 31 01:33:13 GMT 2025","598","","com.distributedMessenger.unit.services.UserServiceUnitTest","","com.distributedMessenger.unit.services.UserServiceUnitTest","register should propagate exception from repository","register should propagate exception from repository",""
"passed","Fri Oct 31 01:32:53 GMT 2025","Fri Oct 31 01:32:53 GMT 2025","53","","com.distributedMessenger.unit.repositories.UserRepositoryUnitTest","","com.distributedMessenger.unit.repositories.UserRepositoryUnitTest","updateUser should correctly change user data","updateUser should correctly change user data",""
"passed","Fri Oct 31 01:35:33 GMT 2025","Fri Oct 31 01:35:35 GMT 2025","1395","","com.distributedMessenger.e2e.bdd.AuthenticationBehaviorSpec","","com.distributedMessenger.e2e.bdd.AuthenticationBehaviorSpec","Then: вход должен быть успешным","Then: вход должен быть успешным",""
"passed","Fri Oct 31 01:33:12 GMT 2025","Fri Oct 31 01:33:12 GMT 2025","33","","com.distributedMessenger.integration.services.UserServiceIntegrationTest","","com.distributedMessenger.integration.services.UserServiceIntegrationTest","getAllUsers should return empty list when database is empty","getAllUsers should return empty list when database is empty",""
"passed","Fri Oct 31 01:33:09 GMT 2025","Fri Oct 31 01:33:09 GMT 2025","27","","com.distributedMessenger.unit.services.MessageServiceUnitTest","","com.distributedMessenger.unit.services.MessageServiceUnitTest","deleteMessage should return true when deletion is successful","deleteMessage should return true when deletion is successful",""
"passed","Fri Oct 31 01:33:09 GMT 2025","Fri Oct 31 01:33:09 GMT 2025","44","","com.distributedMessenger.unit.services.BlockServiceUnitTest","","com.distributedMessenger.unit.services.BlockServiceUnitTest","getUserBlocks should return user's blocks","getUserBlocks should return user's blocks",""
"passed","Fri Oct 31 01:32:52 GMT 2025","Fri Oct 31 01:32:52 GMT 2025","192","","com.distributedMessenger.unit.repositories.MessageHistoryRepositoryUnitTest","","com.distributedMessenger.unit.repositories.MessageHistoryRepositoryUnitTest","addMessageHistory should save a history entry","addMessageHistory should save a history entry",""
"passed","Fri Oct 31 01:32:53 GMT 2025","Fri Oct 31 01:32:53 GMT 2025","58","","com.distributedMessenger.integration.repositories.UserRepositoryIntegrationTest","","com.distributedMessenger.integration.repositories.UserRepositoryIntegrationTest","updateUser for non-existent user should return false","updateUser for non-existent user should return false",""
"passed","Fri Oct 31 01:33:12 GMT 2025","Fri Oct 31 01:33:12 GMT 2025","8","","com.distributedMessenger.unit.services.UserServiceUnitTest","","com.distributedMessenger.unit.services.UserServiceUnitTest","getAllUsers should return a list of users","getAllUsers should return a list of users",""
"passed","Fri Oct 31 01:32:52 GMT 2025","Fri Oct 31 01:32:52 GMT 2025","78","","com.distributedMessenger.unit.repositories.UserRepositoryUnitTest","","com.distributedMessenger.unit.repositories.UserRepositoryUnitTest","findByUsername should return correct user when exists","findByUsername should return correct user when exists",""
"passed","Fri Oct 31 01:33:11 GMT 2025","Fri Oct 31 01:33:12 GMT 2025","29","","com.distributedMessenger.integration.services.UserServiceIntegrationTest","","com.distributedMessenger.integration.services.UserServiceIntegrationTest","updateUserRole should return false for non-existent user","updateUserRole should return false for non-existent user",""
"passed","Fri Oct 31 01:32:53 GMT 2025","Fri Oct 31 01:32:53 GMT 2025","42","","com.distributedMessenger.unit.repositories.UserRepositoryUnitTest","","com.distributedMessenger.unit.repositories.UserRepositoryUnitTest","findByUsername should return null for non-existent username","findByUsername should return null for non-existent username",""
"passed","Fri Oct 31 01:33:08 GMT 2025","Fri Oct 31 01:33:08 GMT 2025","95","","com.distributedMessenger.unit.services.ChatServiceUnitTest","","com.distributedMessenger.unit.services.ChatServiceUnitTest","updateChat should return true when successful","updateChat should return true when successful",""
"passed","Fri Oct 31 01:32:52 GMT 2025","Fri Oct 31 01:32:52 GMT 2025","59","","com.distributedMessenger.unit.repositories.UserRepositoryUnitTest","","com.distributedMessenger.unit.repositories.UserRepositoryUnitTest","addUser should correctly save a user and allow retrieval","addUser should correctly save a user and allow retrieval",""
"passed","Fri Oct 31 01:33:08 GMT 2025","Fri Oct 31 01:33:09 GMT 2025","445","","com.distributedMessenger.unit.services.MessageServiceUnitTest","","com.distributedMessenger.unit.services.MessageServiceUnitTest","editMessage should return false when message to edit is not found","editMessage should return false when message to edit is not found",""
"passed","Fri Oct 31 01:36:08 GMT 2025","Fri Oct 31 01:36:12 GMT 2025","4116","","com.distributedMessenger.e2e.bdd.AuthenticationBehaviorSpec","","com.distributedMessenger.e2e.bdd.AuthenticationBehaviorSpec","Then: операция разблокировки должна быть успешной","Then: операция разблокировки должна быть успешной",""
"passed","Fri Oct 31 01:32:43 GMT 2025","Fri Oct 31 01:32:52 GMT 2025","8510","","com.distributedMessenger.integration.repositories.UserRepositoryIntegrationTest","","com.distributedMessenger.integration.repositories.UserRepositoryIntegrationTest","getUser should retrieve an existing user","getUser should retrieve an existing user",""
"passed","Fri Oct 31 01:33:08 GMT 2025","Fri Oct 31 01:33:08 GMT 2025","35","","com.distributedMessenger.unit.services.BlockServiceUnitTest","","com.distributedMessenger.unit.services.BlockServiceUnitTest","blockUser without reason should work","blockUser without reason should work",""
"passed","Fri Oct 31 01:52:39 GMT 2025","Fri Oct 31 01:52:39 GMT 2025","106","","com.distributedMessenger.generatorreport.GeneratorReport","","com.distributedMessenger.generatorreport.GeneratorReport","fullLoggingReport","fullLoggingReport",""
"passed","Fri Oct 31 01:32:52 GMT 2025","Fri Oct 31 01:32:52 GMT 2025","82","","com.distributedMessenger.integration.repositories.UserRepositoryIntegrationTest","","com.distributedMessenger.integration.repositories.UserRepositoryIntegrationTest","getAllUsers should return an empty list when no users exist","getAllUsers should return an empty list when no users exist",""
"passed","Fri Oct 31 01:35:47 GMT 2025","Fri Oct 31 01:35:53 GMT 2025","5729","","com.distributedMessenger.e2e.bdd.AuthenticationBehaviorSpec","","com.distributedMessenger.e2e.bdd.AuthenticationBehaviorSpec","And: он НЕ может войти со старым паролем","And: он НЕ может войти со старым паролем",""
"passed","Fri Oct 31 01:33:09 GMT 2025","Fri Oct 31 01:33:09 GMT 2025","109","","com.distributedMessenger.unit.services.BlockServiceUnitTest","","com.distributedMessenger.unit.services.BlockServiceUnitTest","getBlock should return null when block does not exist","getBlock should return null when block does not exist",""
"passed","Fri Oct 31 01:33:09 GMT 2025","Fri Oct 31 01:33:09 GMT 2025","18","","com.distributedMessenger.unit.services.MessageServiceUnitTest","","com.distributedMessenger.unit.services.MessageServiceUnitTest","deleteMessage should return false when deletion fails","deleteMessage should return false when deletion fails",""
"passed","Fri Oct 31 01:32:53 GMT 2025","Fri Oct 31 01:32:53 GMT 2025","85","","com.distributedMessenger.unit.repositories.UserRepositoryUnitTest","","com.distributedMessenger.unit.repositories.UserRepositoryUnitTest","getAllUsers should return all added users","getAllUsers should return all added users",""
"passed","Fri Oct 31 01:32:52 GMT 2025","Fri Oct 31 01:32:53 GMT 2025","103","","com.distributedMessenger.integration.repositories.UserRepositoryIntegrationTest","","com.distributedMessenger.integration.repositories.UserRepositoryIntegrationTest","getAllUsers should return all added users","getAllUsers should return all added users",""
"passed","Fri Oct 31 01:33:12 GMT 2025","Fri Oct 31 01:33:12 GMT 2025","10","","com.distributedMessenger.unit.services.UserServiceUnitTest","","com.distributedMessenger.unit.services.UserServiceUnitTest","getAllUsers should return an empty list when no users exist","getAllUsers should return an empty list when no users exist",""
"passed","Fri Oct 31 01:32:52 GMT 2025","Fri Oct 31 01:32:52 GMT 2025","73","","com.distributedMessenger.unit.repositories.ChatRepositoryUnitTest","","com.distributedMessenger.unit.repositories.ChatRepositoryUnitTest","getChat for non-existent id should return null","getChat for non-existent id should return null",""
"passed","Fri Oct 31 01:32:53 GMT 2025","Fri Oct 31 01:32:53 GMT 2025","60","","com.distributedMessenger.unit.repositories.FileRepositoryUnitTest","","com.distributedMessenger.unit.repositories.FileRepositoryUnitTest","addFile should correctly save a file","addFile should correctly save a file",""
"passed","Fri Oct 31 01:33:12 GMT 2025","Fri Oct 31 01:33:12 GMT 2025","6","","com.distributedMessenger.unit.services.UserServiceUnitTest","","com.distributedMessenger.unit.services.UserServiceUnitTest","login should return UserNotFound for non-existent username","login should return UserNotFound for non-existent username",""
"passed","Fri Oct 31 01:33:09 GMT 2025","Fri Oct 31 01:33:09 GMT 2025","191","","com.distributedMessenger.unit.services.UserServiceUnitTest","","com.distributedMessenger.unit.services.UserServiceUnitTest","deleteUser should return true when repository succeeds","deleteUser should return true when repository succeeds",""
"passed","Fri Oct 31 01:33:12 GMT 2025","Fri Oct 31 01:33:14 GMT 2025","2100","","com.distributedMessenger.unit.services.FileServiceUnitTest","","com.distributedMessenger.unit.services.FileServiceUnitTest","deleteFile should return false on failed deletion","deleteFile should return false on failed deletion",""
"passed","Fri Oct 31 01:33:09 GMT 2025","Fri Oct 31 01:33:09 GMT 2025","55","","com.distributedMessenger.unit.services.MessageServiceUnitTest","","com.distributedMessenger.unit.services.MessageServiceUnitTest","editMessage should update message, add history record and return true on success","editMessage should update message, add history record and return true on success",""
"passed","Fri Oct 31 01:32:53 GMT 2025","Fri Oct 31 01:32:53 GMT 2025","39","","com.distributedMessenger.integration.repositories.UserRepositoryIntegrationTest","","com.distributedMessenger.integration.repositories.UserRepositoryIntegrationTest","findByUsername should return null for non-existent username","findByUsername should return null for non-existent username",""
"passed","Fri Oct 31 01:33:12 GMT 2025","Fri Oct 31 01:33:12 GMT 2025","37","","com.distributedMessenger.integration.services.UserServiceIntegrationTest","","com.distributedMessenger.integration.services.UserServiceIntegrationTest","getUser should return user for existing id","getUser should return user for existing id",""
"passed","Fri Oct 31 01:32:53 GMT 2025","Fri Oct 31 01:32:53 GMT 2025","42","","com.distributedMessenger.integration.repositories.UserRepositoryIntegrationTest","","com.distributedMessenger.integration.repositories.UserRepositoryIntegrationTest","getUser with non-existent id should return null","getUser with non-existent id should return null",""
"passed","Fri Oct 31 01:33:08 GMT 2025","Fri Oct 31 01:33:09 GMT 2025","835","","com.distributedMessenger.unit.services.BlockServiceUnitTest","","com.distributedMessenger.unit.services.BlockServiceUnitTest","getUserBlocks should return empty list when user has no blocks","getUserBlocks should return empty list when user has no blocks",""
