"Status","Start Time","Stop Time","Duration in ms","Parent Suite","Suite","Sub Suite","Test Class","Test Method","Name","Description"
"passed","Fri Oct 31 01:35:36 GMT 2025","Fri Oct 31 01:35:40 GMT 2025","4171","","com.distributedMessenger.e2e.bdd.AuthenticationBehaviorSpec","","com.distributedMessenger.e2e.bdd.AuthenticationBehaviorSpec","Then: операция смены пароля должна быть успешной","Then: операция смены пароля должна быть успешной",""
"passed","Fri Oct 31 01:32:52 GMT 2025","Fri Oct 31 01:32:52 GMT 2025","152","","com.distributedMessenger.unit.repositories.BlockRepositoryUnitTest","","com.distributedMessenger.unit.repositories.BlockRepositoryUnitTest","deleteBlocksByUserId should remove the specific block","deleteBlocksByUserId should remove the specific block",""
"passed","Fri Oct 31 01:32:52 GMT 2025","Fri Oct 31 01:32:52 GMT 2025","150","","com.distributedMessenger.unit.repositories.UserRepositoryUnitTest","","com.distributedMessenger.unit.repositories.UserRepositoryUnitTest","getUser should retrieve an existing user","getUser should retrieve an existing user",""
"passed","Fri Oct 31 01:32:43 GMT 2025","Fri Oct 31 01:32:52 GMT 2025","8376","","com.distributedMessenger.unit.repositories.AppSettingsRepositoryUnitTest","","com.distributedMessenger.unit.repositories.AppSettingsRepositoryUnitTest","updateSetting with invalid value should throw IllegalArgumentException","updateSetting with invalid value should throw IllegalArgumentException",""
"passed","Fri Oct 31 01:33:09 GMT 2025","Fri Oct 31 01:33:09 GMT 2025","34","","com.distributedMessenger.unit.services.MessageServiceUnitTest","","com.distributedMessenger.unit.services.MessageServiceUnitTest","sendMessage should save message, send it to network and return id","sendMessage should save message, send it to network and return id",""
"passed","Fri Oct 31 01:32:53 GMT 2025","Fri Oct 31 01:32:53 GMT 2025","43","","com.distributedMessenger.unit.repositories.UserRepositoryUnitTest","","com.distributedMessenger.unit.repositories.UserRepositoryUnitTest","deleteUser for non-existent user should return false","deleteUser for non-existent user should return false",""
"passed","Fri Oct 31 01:32:53 GMT 2025","Fri Oct 31 01:32:53 GMT 2025","33","","com.distributedMessenger.unit.repositories.FileRepositoryUnitTest","","com.distributedMessenger.unit.repositories.FileRepositoryUnitTest","getFile with a non-existent id should return null","getFile with a non-existent id should return null",""
"passed","Fri Oct 31 01:35:40 GMT 2025","Fri Oct 31 01:35:47 GMT 2025","6808","","com.distributedMessenger.e2e.bdd.AuthenticationBehaviorSpec","","com.distributedMessenger.e2e.bdd.AuthenticationBehaviorSpec","And: он может успешно войти с новым паролем","And: он может успешно войти с новым паролем",""
"passed","Fri Oct 31 01:36:12 GMT 2025","Fri Oct 31 01:36:16 GMT 2025","4057","","com.distributedMessenger.e2e.bdd.AuthenticationBehaviorSpec","","com.distributedMessenger.e2e.bdd.AuthenticationBehaviorSpec","And: пользователь может снова успешно войти","And: пользователь может снова успешно войти",""
"passed","Fri Oct 31 01:33:13 GMT 2025","Fri Oct 31 01:33:13 GMT 2025","7","","com.distributedMessenger.unit.services.UserServiceUnitTest","","com.distributedMessenger.unit.services.UserServiceUnitTest","updateUserRole should return false for non-existent user","updateUserRole should return false for non-existent user",""
"passed","Fri Oct 31 01:33:14 GMT 2025","Fri Oct 31 01:33:14 GMT 2025","11","","com.distributedMessenger.unit.services.FileServiceUnitTest","","com.distributedMessenger.unit.services.FileServiceUnitTest","getFile should return file when file exists","getFile should return file when file exists",""
"passed","Fri Oct 31 01:33:09 GMT 2025","Fri Oct 31 01:33:12 GMT 2025","3074","","com.distributedMessenger.unit.services.UserServiceUnitTest","","com.distributedMessenger.unit.services.UserServiceUnitTest","login should return Success for existing username","login should return Success for existing username",""
"passed","Fri Oct 31 01:33:12 GMT 2025","Fri Oct 31 01:33:12 GMT 2025","27","","com.distributedMessenger.integration.services.UserServiceIntegrationTest","","com.distributedMessenger.integration.services.UserServiceIntegrationTest","login should return UserNotFound for non-existent user","login should return UserNotFound for non-existent user",""
"passed","Fri Oct 31 01:33:12 GMT 2025","Fri Oct 31 01:33:12 GMT 2025","29","","com.distributedMessenger.integration.services.UserServiceIntegrationTest","","com.distributedMessenger.integration.services.UserServiceIntegrationTest","updateUser should return false for non-existent user","updateUser should return false for non-existent user",""
"passed","Fri Oct 31 01:52:39 GMT 2025","Fri Oct 31 01:52:39 GMT 2025","189","","com.distributedMessenger.generatorreport.GeneratorReport","","com.distributedMessenger.generatorreport.GeneratorReport","standardLoggingReport","standardLoggingReport",""
"passed","Fri Oct 31 01:32:59 GMT 2025","Fri Oct 31 01:33:08 GMT 2025","8316","","com.distributedMessenger.unit.services.BlockServiceUnitTest","","com.distributedMessenger.unit.services.BlockServiceUnitTest","blockUser should return block id on success","blockUser should return block id on success",""
"passed","Fri Oct 31 01:33:09 GMT 2025","Fri Oct 31 01:33:09 GMT 2025","37","","com.distributedMessenger.unit.services.MessageServiceUnitTest","","com.distributedMessenger.unit.services.MessageServiceUnitTest","getChatMessages should return list of messages for a chat","getChatMessages should return list of messages for a chat",""
"passed","Fri Oct 31 01:33:09 GMT 2025","Fri Oct 31 01:33:09 GMT 2025","37","","com.distributedMessenger.unit.services.MessageServiceUnitTest","","com.distributedMessenger.unit.services.MessageServiceUnitTest","getMessage should return message when it exists","getMessage should return message when it exists",""
"passed","Fri Oct 31 01:32:53 GMT 2025","Fri Oct 31 01:32:53 GMT 2025","51","","com.distributedMessenger.integration.repositories.UserRepositoryIntegrationTest","","com.distributedMessenger.integration.repositories.UserRepositoryIntegrationTest","deleteUser should remove the user from database","deleteUser should remove the user from database",""
"passed","Fri Oct 31 01:33:12 GMT 2025","Fri Oct 31 01:33:12 GMT 2025","39","","com.distributedMessenger.integration.services.UserServiceIntegrationTest","","com.distributedMessenger.integration.services.UserServiceIntegrationTest","updateUser should change username in the database","updateUser should change username in the database",""
"passed","Fri Oct 31 01:32:59 GMT 2025","Fri Oct 31 01:33:07 GMT 2025","7598","","com.distributedMessenger.unit.services.AppSettingsServiceUnitTest","","com.distributedMessenger.unit.services.AppSettingsServiceUnitTest","updateSetting should return false on failed update","updateSetting should return false on failed update",""
"passed","Fri Oct 31 01:33:07 GMT 2025","Fri Oct 31 01:33:07 GMT 2025","24","","com.distributedMessenger.unit.services.AppSettingsServiceUnitTest","","com.distributedMessenger.unit.services.AppSettingsServiceUnitTest","getSetting should return null when setting does not exist","getSetting should return null when setting does not exist",""
"passed","Fri Oct 31 01:32:53 GMT 2025","Fri Oct 31 01:32:53 GMT 2025","51","","com.distributedMessenger.unit.repositories.UserRepositoryUnitTest","","com.distributedMessenger.unit.repositories.UserRepositoryUnitTest","deleteUser should remove the user from database","deleteUser should remove the user from database",""
"passed","Fri Oct 31 01:33:11 GMT 2025","Fri Oct 31 01:33:11 GMT 2025","51","","com.distributedMessenger.integration.services.UserServiceIntegrationTest","","com.distributedMessenger.integration.services.UserServiceIntegrationTest","findByUserName should return null for non-existent user","findByUserName should return null for non-existent user",""
"passed","Fri Oct 31 01:33:08 GMT 2025","Fri Oct 31 01:33:08 GMT 2025","20","","com.distributedMessenger.unit.services.ChatServiceUnitTest","","com.distributedMessenger.unit.services.ChatServiceUnitTest","updateChat should return false when chat not found","updateChat should return false when chat not found",""
"passed","Fri Oct 31 01:33:11 GMT 2025","Fri Oct 31 01:33:11 GMT 2025","369","","com.distributedMessenger.integration.services.UserServiceIntegrationTest","","com.distributedMessenger.integration.services.UserServiceIntegrationTest","register should create a user in the database","register should create a user in the database",""
"passed","Fri Oct 31 01:33:13 GMT 2025","Fri Oct 31 01:33:13 GMT 2025","9","","com.distributedMessenger.unit.services.UserServiceUnitTest","","com.distributedMessenger.unit.services.UserServiceUnitTest","getUser should return null when user does not exist","getUser should return null when user does not exist",""
"passed","Fri Oct 31 01:32:59 GMT 2025","Fri Oct 31 01:33:07 GMT 2025","8401","","com.distributedMessenger.unit.services.ChatServiceUnitTest","","com.distributedMessenger.unit.services.ChatServiceUnitTest","leaveChatNetwork should delegate call to p2pTransport","leaveChatNetwork should delegate call to p2pTransport",""
"passed","Fri Oct 31 01:33:14 GMT 2025","Fri Oct 31 01:33:14 GMT 2025","107","","com.distributedMessenger.unit.services.FileServiceUnitTest","","com.distributedMessenger.unit.services.FileServiceUnitTest","uploadFile should propagate exception when repository throws","uploadFile should propagate exception when repository throws",""
"passed","Fri Oct 31 01:33:13 GMT 2025","Fri Oct 31 01:33:13 GMT 2025","5","","com.distributedMessenger.unit.services.UserServiceUnitTest","","com.distributedMessenger.unit.services.UserServiceUnitTest","deleteUser should return false when repository fails","deleteUser should return false when repository fails",""
"passed","Fri Oct 31 01:33:12 GMT 2025","Fri Oct 31 01:33:12 GMT 2025","33","","com.distributedMessenger.integration.services.UserServiceIntegrationTest","","com.distributedMessenger.integration.services.UserServiceIntegrationTest","getAllUsers should return all users from database","getAllUsers should return all users from database",""
"passed","Fri Oct 31 01:33:14 GMT 2025","Fri Oct 31 01:33:14 GMT 2025","18","","com.distributedMessenger.unit.services.FileServiceUnitTest","","com.distributedMessenger.unit.services.FileServiceUnitTest","deleteFile should return true on successful deletion","deleteFile should return true on successful deletion",""
"passed","Fri Oct 31 01:36:01 GMT 2025","Fri Oct 31 01:36:07 GMT 2025","5639","","com.distributedMessenger.e2e.bdd.AuthenticationBehaviorSpec","","com.distributedMessenger.e2e.bdd.AuthenticationBehaviorSpec","And: аккаунт пользователя 'locker' в базе данных должен быть заблокирован","And: аккаунт пользователя 'locker' в базе данных должен быть заблокирован",""
"passed","Fri Oct 31 01:33:11 GMT 2025","Fri Oct 31 01:33:11 GMT 2025","60","","com.distributedMessenger.integration.services.UserServiceIntegrationTest","","com.distributedMessenger.integration.services.UserServiceIntegrationTest","deleteUser should return false for non-existent user","deleteUser should return false for non-existent user",""
"passed","Fri Oct 31 01:33:12 GMT 2025","Fri Oct 31 01:33:12 GMT 2025","24","","com.distributedMessenger.integration.services.UserServiceIntegrationTest","","com.distributedMessenger.integration.services.UserServiceIntegrationTest","getUser should return null for non-existent id","getUser should return null for non-existent id",""
"passed","Fri Oct 31 01:33:14 GMT 2025","Fri Oct 31 01:33:14 GMT 2025","12","","com.distributedMessenger.unit.services.UserServiceUnitTest","","com.distributedMessenger.unit.services.UserServiceUnitTest","updateUserRole should return true for existing user","updateUserRole should return true for existing user",""
"passed","Fri Oct 31 01:52:39 GMT 2025","Fri Oct 31 01:52:39 GMT 2025","162","","com.distributedMessenger.generatorreport.GeneratorReport","","com.distributedMessenger.generatorreport.GeneratorReport","noLoggingReport","noLoggingReport",""
"passed","Fri Oct 31 01:32:43 GMT 2025","Fri Oct 31 01:32:52 GMT 2025","8515","","com.distributedMessenger.unit.repositories.BlockRepositoryUnitTest","","com.distributedMessenger.unit.repositories.BlockRepositoryUnitTest","addBlock should save a block record","addBlock should save a block record",""
"passed","Fri Oct 31 01:32:53 GMT 2025","Fri Oct 31 01:32:53 GMT 2025","63","","com.distributedMessenger.unit.repositories.FileRepositoryUnitTest","","com.distributedMessenger.unit.repositories.FileRepositoryUnitTest","getFilesByUser should return files only for the specified user","getFilesByUser should return files only for the specified user",""
"passed","Fri Oct 31 01:33:09 GMT 2025","Fri Oct 31 01:33:09 GMT 2025","22","","com.distributedMessenger.unit.services.BlockServiceUnitTest","","com.distributedMessenger.unit.services.BlockServiceUnitTest","blockUser should throw exception when repository fails","blockUser should throw exception when repository fails",""
"passed","Fri Oct 31 01:32:52 GMT 2025","Fri Oct 31 01:32:52 GMT 2025","73","","com.distributedMessenger.integration.repositories.UserRepositoryIntegrationTest","","com.distributedMessenger.integration.repositories.UserRepositoryIntegrationTest","addUser should correctly save a user and allow retrieval","addUser should correctly save a user and allow retrieval",""
